{
  "artifacts": {
    "cohort.json": "4284e869e36940cb776aea5b14fa6d0a42dd700f33ff68b2928a0a58ebf191be",
    "evidence-log.json": "52832efc7e19813f442810a312390908052e2c3ea712d205d0901432ff42a860",
    "evidence-log.md": "8c07fbba489221f6bdcd03c57ec1cd1cfcfde63061f85c73187ba9c324116558",
    "fact-cards.json": "19ef1d743ab354a27ca99e6f9c2fbf2e578fc3b677ef39c96a6033fa4a576e66",
    "formula-decision.json": "c11ac72c03f3358c8c09d9a862f7b19314245c414b55dd66947de45809a99d0f",
    "formula-decision.md": "5890abb60c379cd52388fea0088bee309729f716d5afb384b5b73d77534395a9",
    "linear-attestation.json": null,
    "selection-evaluation.json": "9fc5d6c5e8610382ff956865544e3e6757e131ec71327591a53cca470e518002"
  },
  "input_store_sha256": "6a16599838b8335e58f4e4f985c78d089cdd55e1a9b11696d240414b2fc28c56",
  "run_id": "rationale-selected",
  "schema_version": 1
}
