{
  "artifacts": {
    "cohort.json": "c93426ceb1a914b66bd3a5b368cf04fcb8fb5ddabdee166686c2ef95ca8f65f9",
    "evidence-log.json": "541a1cf2826ccc0b74df52f4b2b3e2875ae12812fe91b9ea0bb616476fd08d11",
    "evidence-log.md": "b960966342bb10edb2c2afe0ecd185a2abb8a352597dbb3764f182b766f69ca6",
    "fact-cards.json": "19ef1d743ab354a27ca99e6f9c2fbf2e578fc3b677ef39c96a6033fa4a576e66",
    "formula-decision.json": "f32ef8b91d0bf911e7681416581c269c7d7da220b387abd38653ae661ebf6611",
    "formula-decision.md": "1362ae20bc9de86a51735e1e7f07b185dd3d18fc3a11a7b405baf86dcb00708b",
    "linear-attestation.json": null,
    "selection-evaluation.json": "22dd8067f16bc26dcdf6164884776ae459d7f582dc1bb3aa745629a78c2da65a"
  },
  "input_store_sha256": "6a16599838b8335e58f4e4f985c78d089cdd55e1a9b11696d240414b2fc28c56",
  "run_id": "rationale-inconclusive",
  "schema_version": 1
}
